{"blocked_state":null,"case_id":"case-b950e308b1384ea5b1655accbd71ddf136f65c01590aab3474b7b27e4d5795b7","completion_semantics":"receiver_last_payload_byte","dependency_mode":"global_step_barrier","error":null,"execution_mode":"full_packet","flow_groups":[{"completed_flow_count":1,"completion_ps":20020,"configuration_id":0,"dependency_ready_ps":0,"depends_on_token_ids":[0],"expected_flow_count":1,"expected_payload_bytes":1000,"flow_group_id":0,"flow_ids":[0],"physical_config_generation":0,"plane_id":0,"program_epoch_id":0,"received_payload_bytes":1000,"release_ps":0,"sent_payload_bytes":1000,"status":"complete","step_id":0},{"completed_flow_count":1,"completion_ps":40240,"configuration_id":1,"dependency_ready_ps":20020,"depends_on_token_ids":[2],"expected_flow_count":1,"expected_payload_bytes":1000,"flow_group_id":1,"flow_ids":[1],"physical_config_generation":1,"plane_id":0,"program_epoch_id":1,"received_payload_bytes":1000,"release_ps":20220,"sent_payload_bytes":1000,"status":"complete","step_id":1}],"flows":[{"dst_rank":1,"flow_group_id":0,"flow_id":0,"last_payload_received_ps":20020,"last_payload_sent_ps":20000,"logical_packet_count":1,"payload_bytes":1000,"received_payload_bytes":1000,"release_ps":0,"sent_payload_bytes":1000,"src_rank":0,"status":"complete"},{"dst_rank":2,"flow_group_id":1,"flow_id":1,"last_payload_received_ps":40240,"last_payload_sent_ps":40220,"logical_packet_count":1,"payload_bytes":1000,"received_payload_bytes":1000,"release_ps":20220,"sent_payload_bytes":1000,"src_rank":0,"status":"complete"}],"invariants":{"all_dependency_tokens_respected":true,"all_flow_groups_complete":true,"all_flows_exact_bytes":true,"all_physical_generations_respected":true,"all_program_epochs_respected":true,"all_routes_match_configuration":true,"all_steps_complete":true,"no_cross_plane_reconfiguration_blocking":true,"no_same_plane_transfer_reconfiguration_overlap":true,"no_unexpected_drop":true,"path_preparation_policy_respected":true,"result_aggregates_match_details":true},"path_preparation_policy":"overlap_earliest","plan_file_sha256":"16ca82bc9d6dd1d93746f56a07302260abc42df938af8afc82b671d118417f7e","planes":[{"busy_time_ps":40000,"epochs":[{"busy_time_ps":20000,"close_ps":20020,"configuration_id":0,"drain_complete_ps":20020,"flow_group_ids":[0],"max_serializer_backlog_bytes":1000,"path_prep_not_before_token_ids":[],"path_prep_start_ps":0,"path_ready_ps":0,"physical_config_generation":0,"program_epoch_id":0,"reconfiguration_end_ps":null,"reconfiguration_start_ps":null,"status":"closed","transfer_complete_ps":20020,"transfer_start_ps":0,"transition":"initial"},{"busy_time_ps":20000,"close_ps":40240,"configuration_id":1,"drain_complete_ps":40240,"flow_group_ids":[1],"max_serializer_backlog_bytes":1000,"path_prep_not_before_token_ids":[],"path_prep_start_ps":20020,"path_ready_ps":20220,"physical_config_generation":1,"program_epoch_id":1,"reconfiguration_end_ps":20220,"reconfiguration_start_ps":20020,"status":"closed","transfer_complete_ps":40240,"transfer_start_ps":20220,"transition":"reconfigure"}],"expected_payload_bytes":2000,"max_serializer_backlog_bytes":1000,"plane_id":0,"received_payload_bytes":2000,"sent_payload_bytes":2000,"source_ports":[{"busy_intervals":[{"end_ps":20000,"start_ps":0,"truncated_at_stop":false},{"end_ps":40220,"start_ps":20220,"truncated_at_stop":false}],"busy_time_ps":40000,"logical_packet_count":2,"max_backlog_bytes":1000,"sent_payload_bytes":2000,"src_rank":0},{"busy_intervals":[],"busy_time_ps":0,"logical_packet_count":0,"max_backlog_bytes":0,"sent_payload_bytes":0,"src_rank":1},{"busy_intervals":[],"busy_time_ps":0,"logical_packet_count":0,"max_backlog_bytes":0,"sent_payload_bytes":0,"src_rank":2},{"busy_intervals":[],"busy_time_ps":0,"logical_packet_count":0,"max_backlog_bytes":0,"sent_payload_bytes":0,"src_rank":3}]}],"provenance":{"build_flags_sha256":"aacbc17de43daac173046dbed82af6ebcfba18acc9cc7ae0797011adfc4efe6c","compiler_id":"hand-authored-fixture","exact_coalesced_equivalence_version":null,"htsim_local_patchset_sha256":"d3096748e023776afd561bfa1a6e1785857eff695b9c4dfca5c3235646275256","htsim_ocs_version":"phase02-golden","htsim_upstream_git_sha":"841d9e7be46bb968eece766aa4b6c044c7799f67","parent_build_commit":"beb976756c5541554edca8eed1376900f581fd18","plan_schema_id":"swot-execution-plan/v2","plan_schema_sha256":"b37ce8b5a87127b84967d990bd0055ef0c6cd5b5be20139e0fef05aac3f17d78","result_schema_id":"swot-simulation-result/v2","result_schema_sha256":"857e2d8d9f91bd17fd140326b832a542e95f323cd243a6bb986ef84ef1390a86"},"run_limits":{"max_events":10000000,"max_sim_time_ps":1000000000000000,"seed":0},"schema_version":"swot-simulation-result/v2","status":"success","steps":[{"completed_flow_group_count":1,"completion_ps":20020,"completion_token_id":2,"expected_flow_group_count":1,"first_flow_group_release_ps":0,"flow_group_ids":[0],"status":"complete","step_id":0},{"completed_flow_group_count":1,"completion_ps":40240,"completion_token_id":4,"expected_flow_group_count":1,"first_flow_group_release_ps":20220,"flow_group_ids":[1],"status":"complete","step_id":1}],"stop_reason":"collective_complete","strategy":"swot","timing":{"collective_complete_ps":40240,"collective_start_ps":0,"simulated_cct_ps":40240,"simulation_stop_ps":40240},"tokens":[{"producer_id":null,"ready_ps":0,"status":"ready","token_id":0,"token_type":"collective_start"},{"producer_id":0,"ready_ps":20020,"status":"ready","token_id":1,"token_type":"flow_group_complete"},{"producer_id":0,"ready_ps":20020,"status":"ready","token_id":2,"token_type":"step_complete"},{"producer_id":1,"ready_ps":40240,"status":"ready","token_id":3,"token_type":"flow_group_complete"},{"producer_id":1,"ready_ps":40240,"status":"ready","token_id":4,"token_type":"step_complete"}],"traffic":{"completed_flow_count":2,"completed_flow_group_count":2,"drops":0,"duplicate_payload_bytes":0,"expected_flow_count":2,"expected_flow_group_count":2,"expected_payload_bytes":2000,"in_flight_transit_unit_count":0,"logical_packet_count":2,"missing_payload_bytes":0,"per_plane_payload_bytes":[2000],"per_rank_received_payload_bytes":[0,1000,1000,0],"per_rank_sent_payload_bytes":[2000,0,0,0],"processed_event_count":9,"received_payload_bytes":2000,"sent_payload_bytes":2000,"simulated_transit_unit_count":2,"unfinished_flow_ids":[],"wire_bytes":2000},"transport_mode":"paper_exact","units":{"data":"byte","rate":"bit_per_second","time":"picosecond"},"wire_model":"payload_only"}
