{"blocked_state":null,"case_id":null,"completion_semantics":null,"dependency_mode":null,"error":{"entity_id":null,"entity_type":"none","error_code":"schema_validation_error","json_pointer":"/plane_programs/0/epochs","message":"plan validation failed","plane_id":null},"execution_mode":null,"flow_groups":[],"flows":[],"invariants":{"all_dependency_tokens_respected":null,"all_flow_groups_complete":null,"all_flows_exact_bytes":null,"all_physical_generations_respected":null,"all_program_epochs_respected":null,"all_routes_match_configuration":null,"all_steps_complete":null,"no_cross_plane_reconfiguration_blocking":null,"no_same_plane_transfer_reconfiguration_overlap":null,"no_unexpected_drop":null,"path_preparation_policy_respected":null,"result_aggregates_match_details":null},"path_preparation_policy":null,"plan_file_sha256":"5b1bbb3ccaf9457d8db99382db94902e7f31cd067c5663d982375924961202e7","planes":[],"provenance":null,"run_limits":null,"schema_version":"swot-simulation-result/v2","status":"failure","steps":[],"stop_reason":"invalid_input","strategy":null,"timing":{"collective_complete_ps":null,"collective_start_ps":null,"simulated_cct_ps":null,"simulation_stop_ps":null},"tokens":[],"traffic":null,"transport_mode":null,"units":null,"wire_model":null}
